{
  "name": "pentestcode",
  "version": "s0ld13rr-latest",
  "category": "seceng",
  "recipe": "glibc-bun",
  "source": {
    "url": "https://github.com/s0ld13rr/pentestcode",
    "size_mb": 120
  },
  "deps": ["glibc-repo", "patchelf"],
  "post_install": "pentestcode --version",
  "notes": "OpenCode hard fork for offensive security. Needs same patchelf+LD_PRELOAD resolv-shim recipe as opencode. Optional helper: pkg install nmap netcat-openbsd dnsutils sqlmap. DO NOT AUTO-INSTALL — user must approve (security tooling).",
  "verified_on": "pending"
}
